[
  {
    "code": "BEL",
    "name": "Bellamy Building",
    "aliases": [
      "bel",
      "bellamy",
      "the bel",
      "the bellamy"
    ],
    "campusZone": "academic-core",
    "centroid": {
      "lat": 30.4432651,
      "lon": -84.2958913
    },
    "entrances": [
      {
        "id": "centroid-stand-in",
        "label": "Bellamy Building — building centre, exact doors not yet surveyed",
        "point": {
          "lat": 30.4432651,
          "lon": -84.2958913
        },
        "entranceType": "main",
        "accessNote": "NOT A REAL DOOR. No entrance location for this building could be sourced, so the walk graph anchors on the building centre instead. Walking estimates through this node are therefore short by the distance from the centre of the building to whichever door you actually use — typically 10 to 40 metres at each end of a trip. Do not present this as \"leave by the north doors\".",
        "confidence": "unknown"
      }
    ],
    "floorCount": 7,
    "typicalClassroomFloors": [
      0,
      1,
      2,
      4
    ],
    "notes": "FSU building number 0008, FSU space zone \"ZONE C\", street address 113 COLLEGIATE LOOP. FSU's room inventory lists 34 rooms of type \"(110) CLASSROOM\" in this building, which is the measure used to decide what shipped in this release.",
    "provenance": {
      "sourceUrl": "https://www.facilities.fsu.edu/portal/building/?bldg=0008",
      "retrievedOn": "2026-08-27",
      "method": "computed",
      "confidence": "medium",
      "note": "Identity, official name and floor counts read from the FSU Building Portal; coordinate taken from the OpenStreetMap building polygon whose name matches after case and punctuation normalisation. The OSM polygon carries no address tag, so the pairing rests on the name alone. OpenStreetMap element(s): way/865077781 \"Bellamy\" (https://www.openstreetmap.org/way/865077781). No entrance was sourced for this building; the single entrance record is the centroid."
    },
    "source": {
      "url": "https://www.facilities.fsu.edu/portal/building/?bldg=0008",
      "label": "FSU Planning, Design & Construction — Building Information Portal",
      "retrievedAt": "2026-08-27T12:00:00-04:00",
      "confidence": "verified"
    }
  },
  {
    "code": "CRM",
    "name": "Criminology and Criminal Justice Building",
    "aliases": [
      "criminology and criminal justice",
      "crm",
      "the criminology and criminal justice",
      "the crm"
    ],
    "campusZone": "academic-core",
    "centroid": {
      "lat": 30.4413472,
      "lon": -84.2913485
    },
    "entrances": [
      {
        "id": "centroid-stand-in",
        "label": "Criminology and Criminal Justice Building — building centre, exact doors not yet surveyed",
        "point": {
          "lat": 30.4413472,
          "lon": -84.2913485
        },
        "entranceType": "main",
        "accessNote": "NOT A REAL DOOR. No entrance location for this building could be sourced, so the walk graph anchors on the building centre instead. Walking estimates through this node are therefore short by the distance from the centre of the building to whichever door you actually use — typically 10 to 40 metres at each end of a trip. Do not present this as \"leave by the north doors\".",
        "confidence": "unknown"
      }
    ],
    "floorCount": 4,
    "typicalClassroomFloors": [
      2
    ],
    "notes": "FSU building number 0005, FSU space zone \"ZONE C\", street address 112 S COPELAND ST. FSU's room inventory lists 2 rooms of type \"(110) CLASSROOM\" in this building, which is the measure used to decide what shipped in this release.",
    "provenance": {
      "sourceUrl": "https://www.facilities.fsu.edu/portal/building/?bldg=0005",
      "retrievedOn": "2026-08-27",
      "method": "computed",
      "confidence": "high",
      "note": "Identity, official name and floor counts read from the FSU Building Portal; coordinate taken from the OpenStreetMap building polygon whose addr:housenumber and addr:street match the FSU street address exactly. Two independent sources agree on the address, so the pairing is not a guess. OpenStreetMap element(s): way/137489141 \"Criminology and Criminal Justice Building\" (https://www.openstreetmap.org/way/137489141). No entrance was sourced for this building; the single entrance record is the centroid."
    },
    "source": {
      "url": "https://www.facilities.fsu.edu/portal/building/?bldg=0005",
      "label": "FSU Planning, Design & Construction — Building Information Portal",
      "retrievedAt": "2026-08-27T12:00:00-04:00",
      "confidence": "verified"
    }
  },
  {
    "code": "DIF",
    "name": "Diffenbaugh Building",
    "aliases": [
      "dif",
      "diffenbaugh",
      "the dif",
      "the diffenbaugh"
    ],
    "campusZone": "academic-core",
    "centroid": {
      "lat": 30.439995,
      "lon": -84.2912747
    },
    "entrances": [
      {
        "id": "centroid-stand-in",
        "label": "Diffenbaugh Building — building centre, exact doors not yet surveyed",
        "point": {
          "lat": 30.439995,
          "lon": -84.2912747
        },
        "entranceType": "main",
        "accessNote": "NOT A REAL DOOR. No entrance location for this building could be sourced, so the walk graph anchors on the building centre instead. Walking estimates through this node are therefore short by the distance from the centre of the building to whichever door you actually use — typically 10 to 40 metres at each end of a trip. Do not present this as \"leave by the north doors\".",
        "confidence": "unknown"
      }
    ],
    "floorCount": 5,
    "typicalClassroomFloors": [
      0,
      1,
      2,
      3
    ],
    "notes": "FSU building number 0002, FSU space zone \"ZONE C\", street address 625 UNIVERSITY WAY. FSU's room inventory lists 25 rooms of type \"(110) CLASSROOM\" in this building, which is the measure used to decide what shipped in this release.",
    "provenance": {
      "sourceUrl": "https://www.facilities.fsu.edu/portal/building/?bldg=0002",
      "retrievedOn": "2026-08-27",
      "method": "computed",
      "confidence": "high",
      "note": "Identity, official name and floor counts read from the FSU Building Portal; coordinate taken from the OpenStreetMap building polygon whose addr:housenumber and addr:street match the FSU street address exactly. Two independent sources agree on the address, so the pairing is not a guess. OpenStreetMap element(s): way/127100106 \"Diffenbaugh Building\" (https://www.openstreetmap.org/way/127100106). No entrance was sourced for this building; the single entrance record is the centroid."
    },
    "source": {
      "url": "https://www.facilities.fsu.edu/portal/building/?bldg=0002",
      "label": "FSU Planning, Design & Construction — Building Information Portal",
      "retrievedAt": "2026-08-27T12:00:00-04:00",
      "confidence": "verified"
    }
  },
  {
    "code": "DSL",
    "name": "Dirac Science Library",
    "aliases": [
      "dirac science",
      "dirac science library",
      "dsl",
      "the dirac science",
      "the dsl"
    ],
    "campusZone": "academic-core",
    "centroid": {
      "lat": 30.4450146,
      "lon": -84.2999491
    },
    "entrances": [
      {
        "id": "centroid-stand-in",
        "label": "Dirac Science Library — building centre, exact doors not yet surveyed",
        "point": {
          "lat": 30.4450146,
          "lon": -84.2999491
        },
        "entranceType": "main",
        "accessNote": "NOT A REAL DOOR. No entrance location for this building could be sourced, so the walk graph anchors on the building centre instead. Walking estimates through this node are therefore short by the distance from the centre of the building to whichever door you actually use — typically 10 to 40 metres at each end of a trip. Do not present this as \"leave by the north doors\".",
        "confidence": "unknown"
      }
    ],
    "floorCount": 4,
    "typicalClassroomFloors": [
      1,
      4
    ],
    "notes": "FSU building number 0020, FSU space zone \"ZONE A\", street address 110 N WOODWARD AVE. FSU's room inventory lists 3 rooms of type \"(110) CLASSROOM\" in this building, which is the measure used to decide what shipped in this release.",
    "provenance": {
      "sourceUrl": "https://www.facilities.fsu.edu/portal/building/?bldg=0020",
      "retrievedOn": "2026-08-28",
      "method": "computed",
      "confidence": "medium",
      "note": "Identity, official name, address and floor data read from the FSU Building Portal and its room-lookup service; coordinate taken from the OpenStreetMap element named \"Dirac Science Library\". OpenStreetMap element(s): node/12550200644 \"Dirac Science Library\" (https://www.openstreetmap.org/node/12550200644), tagged amenity=library. This is a POINT OF INTEREST NODE INSIDE the building, not a building polygon centroid, so it names the right building but is offset from its geometric centre by an unknown amount — unlike every other coordinate in this file, which comes from a polygon. OSM gives its address as 600 Learning Way while FSU gives 110 N Woodward Ave. The pairing is corroborated by a separate Nominatim lookup of \"110 N Woodward Ave, Tallahassee, FL\", whose first result is a Starbucks (node/9961388586) 36 m away — consistent with the cafe inside this library. That lookup also returns a second, unnamed address point (way/863077705) 190 m away carrying the same street address, so the address alone does not identify the building. Confidence is medium. No entrance was sourced for this building; the single entrance record is the centroid."
    },
    "source": {
      "url": "https://www.facilities.fsu.edu/portal/building/?bldg=0020",
      "label": "FSU Planning, Design & Construction — Building Information Portal",
      "retrievedAt": "2026-08-28T12:00:00-04:00",
      "confidence": "verified"
    }
  },
  {
    "code": "FAB",
    "name": "Fine Arts Building",
    "aliases": [